User01, 2021, 08, 07, 08, 14, 00, I think that racism in this country sucks!
User99, 2022, 12, 14, 13, 31, 58, I agree that we need to have higher taxes on the rich!
User02, 2020, 12, 23, 08, 00, 00, Happy Holidays everyone!
User02, 2021, 01, 01, 08, 00, 00, Happy New Year everyone!
User03, 2021, 01, 01, 08, 10, 00, I don't believe in celebrating New Year's
User02, 2021, 01, 02, 08, 15, 20, Ahhhhh don't be that way
User08, 2021, 01, 03, 10, 30, 14, Hey everyone I just got a raise!
User01, 2021, 01, 04, 08, 15, 23, Happy new Year to you too John!
User01, 2020, 12, 24, 13, 22, 47, Happy Holidays to you too John!
User03, 2022, 01, 05, 12, 01, 38, I think I'll go play soccer today with my friends
User01, 2022, 01, 05, 12, 07, 19, Let me know where that will be and I'll join you!
User04, 2023, 02, 10, 09, 45, 28, Just booked my vacation to Hawaii!
User05, 2023, 02, 12, 14, 20, 59, Excited to start my new job tomorrow!
User06, 2023, 02, 15, 11, 05, 42, Trying out a new recipe tonight!
User07, 2023, 02, 18, 16, 30, 17, Can't wait for the weekend!
User09, 2023, 02, 22, 13, 12, 05, Enjoying a relaxing day at the beach.
User10, 2023, 02, 25, 20, 55, 38, Just finished reading an amazing book!
User11, 2023, 03, 01, 07, 40, 21, Good morning, everyone!
User12, 2023, 03, 04, 16, 18, 54, Celebrating my birthday today!
User13, 2023, 03, 07, 10, 29, 33, Watching my favorite TV show tonight.
User14, 2023, 03, 10, 19, 47, 12, Just adopted a cute puppy!
User15, 2023, 03, 15, 08, 36, 09, Excited for my upcoming road trip!
User16, 2023, 03, 20, 12, 55, 40, Enjoying a delicious meal with friends.
User17, 2023, 03, 25, 17, 10, 27, Going for a hike this weekend.
User18, 2023, 03, 30, 09, 22, 16, Celebrating my anniversary today!
User19, 2023, 04, 05, 15, 41, 55, Just finished a challenging workout.
User20, 2023, 04, 11, 11, 05, 03, Looking forward to the spring season!
User21, 2023, 04, 17, 18, 30, 49, Enjoying a cup of coffee on a rainy day.
User22, 2023, 04, 24, 13, 20, 08, Exploring a new city this weekend.
User23, 2023, 05, 01, 08, 45, 32, Trying out a new hobby.
User24, 2023, 05, 08, 17, 15, 16, Celebrating Mother's Day with my family.